{
  "naics":"541120","title":"Offices of Notaries",
  "run_meta":{"model_id":"gpt-5.6-terra","run_date":"2026-07-21","run_id":"2026-07-21_gpt-5.6-terra_v312p1_541120","template_version":"3.1.2","prompt_version":"v3.1.2-text-first-1","attempt":1},
  "narrative":{"executive_view":"Offices of Notaries are not a credible $1–10M EBITDA acquisition screen. The code has no usable government count, its supplied labor and role data are a lawyer-industry proxy, and the actual service is commonly solo, capped-fee work. Remote online notarization preserves a commissioned human but moves customer access, identity infrastructure and workflow ownership to platforms [S2].","how_ai_changes_work":"AI can automate intake, document classification, appointment scheduling, identity-workflow assistance and closing coordination. It cannot independently perform the statutory notarial act: even remote notarization uses a live commissioned notary and an electronic seal [S3]. The supplied lawyer/paralegal mix would substantially overstate task value for actual notary offices, so role fractions are intentionally low-confidence proxy judgments.","value_capture":"Savings from office administration are hard for a notary operator to retain. Florida, an illustrative large-state legal regime, caps a traditional notarial act at $10 [S1], while RON platforms aggregate demand and provide network notaries on demand [S2]. This means platforms, title/lender buyers and customers can take the benefit; statutory caps constrain the basic act even where travel or platform fees differ.","adoption_timing":"RON is already operational at scale: Proof advertises a 24/7 network and says its platform completed millions of notarizations [S2]. That is not a census of 541120 firms, but it supports a view that effective digital workflow adoption is above 50% for addressable high-volume demand. Accordingly t50 is set to zero; implementation remains uneven among solo mobile notaries.","consolidation_economics":"The market is overwhelmingly unsuitable for the target EBITDA band. Because the deterministic record has n_total=0 and n_band=null, the required fallback uses an honest near-zero estimate: a generous ceiling of 100,000 potential independent operators, $40,000 annual revenue per operator and 20% EBITDA margin imply only $8,000 EBITDA per operator, far below $1M. No observed firm-count source or code-specific financial series was reopened, so this is an estimate rather than false precision.","terminal_demand":"Demand for legally valid witnessing is durable in the near term because remote workflows still require a commissioned notary and live video process [S3]. But the office as a paid seller is pressured: a platform can match a signer to a network notary with very low wait time [S2], making the local office's client relationship and distribution less durable than the statutory act itself.","risks_and_uncertainty":"All quantitative industry claims are weak because 541120 lacks a usable code-level public series and the supplied role mix is 5411 legal services. Fee rules differ by state; Florida's cap is an illustrative price constraint, not a national average. Mortgage/real-estate transactions are cyclical—MBA forecast 5.8 million mortgage loans in 2026, up from 5.4 million in 2025 [S4]—so demand volume can change without creating firm-level acquisition value."},
  "sources":[
    {"id":"S1","url":"https://www.leg.state.fl.us/statutes/index.cfm/Sections/index.cfm?App_mode=Display_Statute&URL=0100-0199%2F0117%2FSections%2F0117.05.html","title":"Florida Statutes, section 117.05: notary fee","access_date":"2026-07-21","what_it_supports":"Illustrative statutory maximum of $10 for a Florida notarial act; state-specific fee-cap caveat."},
    {"id":"S2","url":"https://www.proof.com/product/notarize","title":"Proof Notarize product and Notarize Network","access_date":"2026-07-21","what_it_supports":"Platform-operated on-demand network, 24/7 access, claimed scale and distribution role in remote notarization."},
    {"id":"S3","url":"https://support.proof.com/hc/en-us/articles/360058809173-Traditional-vs-Remote-Online-Notarization","title":"Traditional vs. Remote Online Notarization","access_date":"2026-07-21","what_it_supports":"RON uses a live notary, identity checks, a digital seal and the same legal process; platform scope caveat."},
    {"id":"S4","url":"https://www.mba.org/news-and-research/newsroom/news/2025/10/19/mba-forecast--total-single-family-mortgage-originations-to-increase-8-percent-to--2.2-trillion-in-2026","title":"MBA Forecast: Total Single-Family Mortgage Originations to Increase 8 percent to $2.2 Trillion in 2026","access_date":"2026-07-21","what_it_supports":"Mortgage-originations forecast and demand cyclicality context, not notary-industry size."}
  ],
  "dataset_fallbacks":{"n_band":{"value":0,"method":"ESTIMATE","evidence_quality":"LOW","confidence":"LOW","source_ids":["S1","S2"],"rationale":"Shown conservative feasibility chain: assume a generous 100,000 potential independent operators, $40,000 annual revenue/operator and 20% EBITDA margin = $8,000 EBITDA/operator; this is below $1M, so the estimated count in the $1–10M EBITDA band is zero. Fee caps [S1] and platform distribution [S2] make this near-zero conclusion directionally more plausible, but neither source observes the assumed population, revenue or margin.","plausible_range":"0-5 firms","caveats":["No SUSB/QCEW code-level count exists in the supplied record.","The 100,000, $40,000 and 20% inputs are deliberately generous estimates, not observed code-level data.","A rare multi-office or title-adjacent business may lie outside this estimate and should not be counted as a typical 541120 office."]}},
  "scorecard":{"ai_replaceable_share":{"method":"ESTIMATE","evidence_quality":"LOW","confidence":"LOW","source_ids":["S2","S3"],"rationale":"The supplied 5411 legal-services mix is a poor proxy, but platform/RON evidence supports automation of intake and administration while commissioned witnessing remains human.","plausible_range":"0.25-0.50 of supplied legal-services proxy wages","caveats":["Supplied roles are 5411 lawyers, not actual 541120 notary-office staffing.","The result should not be read as an observed notary payroll mix."],"role_judgments":[
    {"soc":"23-1011","within_role_automatable_fraction":0.22,"rationale":"Lawyer proxy: drafting/research assist, but legal judgment and client responsibility remain.","plausible_range":"0.10-0.35"},{"soc":"23-2011","within_role_automatable_fraction":0.48,"rationale":"Paralegal proxy: document preparation and retrieval automate with review.","plausible_range":"0.30-0.65"},{"soc":"43-6012","within_role_automatable_fraction":0.62,"rationale":"Legal-secretary proxy: scheduling and document routing automate heavily.","plausible_range":"0.40-0.80"},{"soc":"43-9061","within_role_automatable_fraction":0.65,"rationale":"General office clerical workflow is automation-friendly.","plausible_range":"0.45-0.80"},{"soc":"43-4171","within_role_automatable_fraction":0.60,"rationale":"Routine inquiries and appointment booking automate; escalations remain.","plausible_range":"0.40-0.75"},{"soc":"43-3031","within_role_automatable_fraction":0.55,"rationale":"Bookkeeping reconciliation automates with oversight.","plausible_range":"0.35-0.70"},{"soc":"43-1011","within_role_automatable_fraction":0.28,"rationale":"Reporting automates but supervision remains.","plausible_range":"0.12-0.42"},{"soc":"43-6014","within_role_automatable_fraction":0.60,"rationale":"Scheduling and correspondence automate substantially.","plausible_range":"0.40-0.75"},{"soc":"23-2093","within_role_automatable_fraction":0.40,"rationale":"Search and document tasks automate partly, with verification retained.","plausible_range":"0.20-0.60"},{"soc":"11-1021","within_role_automatable_fraction":0.25,"rationale":"Managerial planning remains human; reporting support automates.","plausible_range":"0.10-0.40"},{"soc":"RESIDUAL","within_role_automatable_fraction":0.45,"rationale":"Unlisted proxy work is mixed administrative/legal support.","plausible_range":"0.25-0.60"}]},
    "pi_dist":{"value":0.18,"method":"ESTIMATE","evidence_quality":"MED","confidence":"LOW","source_ids":["S1","S2"],"rationale":"Statutory fee ceilings and platform-mediated distribution constrain an office's retention of administrative savings.","plausible_range":"0.08-0.35","caveats":["Florida's cap is illustrative, not national; travel, RON and signing-service fees differ by state and buyer." ]},
    "pi_moat":{"value":0.12,"method":"ESTIMATE","evidence_quality":"MED","confidence":"LOW","source_ids":["S2","S3"],"rationale":"A RON platform can provide vetted network notaries and workflow infrastructure, leaving a standalone office with limited distribution moat.","plausible_range":"0.05-0.25","caveats":["Proof is a platform source and does not measure every local notary's client relationship." ]},
    "t50_years":{"value":0,"method":"ESTIMATE","evidence_quality":"MED","confidence":"MED","source_ids":["S2","S3"],"rationale":"Platform-scale RON and 24/7 network supply support an estimate that effective digital workflow adoption for addressable high-volume notarization is already at least 50%.","plausible_range":"0-2 years","caveats":["Not a census of NAICS 541120 firms; solo mobile work may lag." ]},
    "current_adoption_pct":{"value":0.55,"method":"ESTIMATE","evidence_quality":"MED","confidence":"LOW","source_ids":["S2","S3"],"rationale":"Set above 50% from visible large-scale RON/platform operation, not an observed industry penetration statistic.","plausible_range":"0.35-0.75","caveats":["Platform evidence cannot establish a national code-level adoption rate." ]},